{
  "device": "smartphone",
  "medium": "app",
  "entity": "71ad569b-b248-47ab-a468-952f3dac3dd2",
  "hint": "Lorem ipsum dolor sit amet, consetetur sadipscing elitr, sed diam nonumy eirmod tempor invidunt ut labore et dolore magna aliquyam erat, sed diam voluptua. At vero eos et accusam et justo duo dolores et ea rebum. Stet clita kasd gubergren, no sea takimata sanctus est Lorem ipsum dolor sit amet.",
  "locale": "de-DE"
}
